{
  "schema_version": "evidence-result/v0",
  "result_id": "22222222-2222-4222-8222-222222222222",
  "manifest_id": "11111111-1111-4111-8111-111111111111",
  "manifest_sha256": "8c5b48f9c9a673b30a36e3bf3ede4f5ef05374205b1dd85dbbfca5cac1729336",
  "test_id": "capture.64ch.48k.nominal-soak.v1",
  "commit": "6666666666666666666666666666666666666666",
  "runner_id": "fixture-runner",
  "started_utc": "2026-09-19T00:00:00Z",
  "ended_utc": "2026-09-20T12:03:00Z",
  "assertions": [
    {"id": "audio.callback_underruns.zero", "status": "fail", "observed": 1, "unit": "count"},
    {"id": "audio.frame_loss.zero", "status": "pass", "observed": 0, "unit": "frames"},
    {"id": "audio.frame_insertion.zero", "status": "pass", "observed": 0, "unit": "frames"},
    {"id": "audio.channel_permutation.zero", "status": "pass", "observed": 0, "unit": "count"},
    {"id": "audio.channel_duplication.zero", "status": "pass", "observed": 0, "unit": "count"},
    {"id": "audio.cross_channel_contamination.zero", "status": "pass", "observed": 0, "unit": "count"},
    {"id": "audio.callback_p99_fraction.lte_0_50", "status": "pass", "observed": 410000, "unit": "ppm"},
    {"id": "audio.callback_max_fraction.lt_0_80", "status": "pass", "observed": 710000, "unit": "ppm"}
  ],
  "artifacts": [
    {"kind": "runner-log", "sha256": "1111111111111111111111111111111111111111111111111111111111111111", "bytes": 1000, "store_key": "fixture/runner.log"},
    {"kind": "integrity-oracle", "sha256": "2222222222222222222222222222222222222222222222222222222222222222", "bytes": 2000, "store_key": "fixture/oracle.json"},
    {"kind": "callback-metrics", "sha256": "3333333333333333333333333333333333333333333333333333333333333333", "bytes": 3000, "store_key": "fixture/callback.json"},
    {"kind": "hardware-manifest", "sha256": "4444444444444444444444444444444444444444444444444444444444444444", "bytes": 4000, "store_key": "fixture/hardware.json"}
  ],
  "deviations": [],
  "waiver_ids": [],
  "signature": {
    "alg": "ES256",
    "key_id": "test-runner-2026",
    "value": "X0A8nVJWlcUFbBNGhgYpaUdqVu6r7xbsDaPDbYLmv4VtTewLSuhILLEQ6WEmOkJxgQSGkie8MbX8YfnQucIqwA"
  }
}
